id_personal,id_publicidad,fecha_asignado,tiempo_asignado,trabajo_a_realizar
135,404,2022-09-13,10,Information upon environment let pick.
276,146,2022-08-09,1,Movement up later avoid matter.
428,302,2023-08-28,12,Present skin lead popular TV some seven.
89,427,2024-03-18,16,Beat pick then here kind exactly hand lose.
336,292,2023-05-05,8,Us service state two somebody.
540,464,2023-09-28,22,I eat everyone remain top bag.
36,276,2022-02-17,13,Easy truth less western statement.
624,498,2022-07-24,6,Speech voice she from left radio.
630,231,2021-05-07,11,Visit piece live industry word movement wear.
656,547,2024-02-28,6,Off my allow start generation.
649,186,2021-08-26,21,Appear keep style catch. Simple marriage modern.
691,364,2021-05-31,9,Military Mr threat foreign.
75,227,2022-04-29,12,Bar party moment first quickly.
458,691,2021-05-08,10,Common specific live economy.
6,416,2022-01-29,18,Benefit wind just life hard current.
215,126,2022-12-07,9,Talk measure before probably sit would.
34,451,2023-06-19,15,Plan reduce spring ground he property religious.
408,559,2024-02-17,12,Process central final south bad especially.
222,389,2022-02-28,11,Ahead thing focus rule carry.
443,645,2021-07-31,17,Nice couple everyone. Skill rule despite so.
273,311,2022-02-06,15,Yet push reveal her always benefit act.
677,460,2023-06-07,9,Of although person later through.
501,291,2022-03-14,3,Kitchen lay day almost exactly head leader no.
21,579,2023-03-31,20,Region system with spring be.
15,337,2023-12-03,17,Top middle sea. Marriage focus why life toward.
642,545,2024-03-22,14,Scene while seem out son.
608,368,2023-01-08,22,Determine figure chair yard.
557,149,2022-12-24,14,Must sell ball society.
534,64,2022-11-26,5,Which official speak seat section able I.
358,42,2023-11-14,12,To message way book suddenly.
435,594,2024-03-19,14,Act military data response.
363,615,2021-08-28,13,Peace test coach article.
52,378,2021-08-30,6,Than ok region.
145,34,2022-11-09,20,Different sell wear figure.
77,320,2023-05-27,12,Standard thank age generation chance add.
515,115,2023-08-17,7,Pull game thus politics friend manage.
291,348,2023-05-14,14,Fear as then foreign particularly through way.
173,590,2021-06-19,14,In cut appear find able break.
605,54,2021-06-29,17,Much music establish almost.
511,535,2024-03-15,24,Source third keep key.
417,58,2022-11-30,1,Operation alone gun reduce onto rate local call.
339,70,2024-03-14,9,Cold game air ask line.
279,35,2024-02-23,9,Administration cup fund program majority take.
9,562,2022-03-18,18,Threat nice I ahead.
219,219,2021-12-27,21,Difference human office school.
95,401,2022-09-14,23,Future rest black.
203,25,2022-05-30,16,Do end type side situation care quickly.
520,9,2022-12-26,16,Should student study including bag foot society.
470,367,2023-06-18,7,Though hospital yes health ball which.
541,470,2021-11-27,18,Peace PM perform behind point many produce.
658,675,2023-08-18,22,Feeling attack list box.
450,624,2023-10-19,13,Mr whose girl summer. Challenge official group.
119,247,2022-09-19,19,No contain concern task which voice.
248,671,2022-03-17,4,Building this measure hundred.
202,685,2022-06-16,18,Here learn always simply role simple television.
621,80,2022-05-22,3,How quality big choose member mean decide.
475,151,2023-02-28,9,Agency light perhaps phone head he live.
686,412,2023-12-31,8,Situation dark lay woman school gun.
595,489,2022-06-30,8,Morning shake exactly education season star.
530,582,2022-09-29,8,Either mean people person almost.
379,325,2023-07-19,22,Discover fear and low draw town employee.
118,165,2021-12-20,21,Hour short decision. Contain past blue theory.
149,435,2023-11-18,1,Group do sing total art read financial.
264,551,2022-03-29,5,Wait father lot nearly wonder building.
240,530,2021-11-14,1,Player son court every.
653,189,2022-06-12,19,Pick scientist during under technology.
71,268,2021-11-26,22,Own hard thing kid suddenly range.
505,207,2023-06-26,6,Put then responsibility.
174,33,2021-09-13,3,Argue leg light especially politics.
360,148,2023-02-07,9,Process current affect box computer federal grow.
604,655,2023-05-20,23,Skill example produce test open chair always.
628,431,2024-01-30,12,Begin offer home small.
503,177,2023-08-03,18,Radio great best. Nice itself party hour stay.
446,598,2021-10-06,17,He especially method memory style beautiful.
262,178,2022-06-05,16,Gun little his crime step.
521,518,2021-06-04,2,Travel physical some ready return sort.
586,75,2022-11-02,23,Probably task organization beyond member.
445,428,2023-03-16,7,Grow star wall ability grow despite degree.
652,660,2024-01-20,22,Recently process task land final call land.
600,307,2021-08-17,3,Sit book huge difference natural.
641,212,2022-04-17,2,Section cell history leave phone.
266,138,2022-02-16,24,Each assume play style part.
376,289,2023-12-30,9,Wife PM possible instead current into.
185,38,2022-12-30,15,And system agent prove technology.
113,125,2022-09-19,14,Table choice of concern we inside store.
263,249,2023-07-18,20,South continue dream yard.
125,481,2023-04-07,16,Nation chair a sense local fire few.
224,43,2023-01-14,5,Position may guy. Class race goal store.
86,192,2023-06-09,6,Chance factor speech store baby vote tend.
11,414,2022-07-08,3,Perform catch may south.
301,628,2021-06-02,12,Certain where stop try.
68,267,2023-04-05,11,Half beat form produce.
684,194,2023-02-17,5,Pm open outside.
295,371,2022-09-22,24,Republican street research kid member.
66,550,2022-12-15,14,Change new avoid page last.
261,418,2021-05-22,7,Respond imagine economic group.
420,298,2023-05-24,12,Service grow it suddenly interview firm company.
532,639,2024-02-04,13,Develop break street watch become appear I.
229,612,2023-11-02,24,Sell building money capital machine.
429,424,2023-04-13,23,Nation even majority money recently hair.
407,507,2023-01-25,21,Coach western cold design raise.
129,663,2024-02-23,12,Current a relate ahead consumer gas page.
101,525,2021-10-13,11,Administration someone stop draw whole yet party.
431,497,2021-11-22,13,A report animal doctor event me.
121,66,2022-02-27,15,Level involve weight approach.
555,376,2023-07-03,16,Charge election crime religious to.
85,301,2022-04-26,17,Wife friend arrive fly.
468,642,2023-04-06,3,Population mention cup nothing work short.
128,338,2022-09-07,16,Some sport its notice management.
438,210,2023-04-01,14,Also investment partner both share student case.
500,528,2023-12-11,21,International onto learn money.
27,232,2023-12-16,7,Truth course set. Miss spring every.
161,493,2023-06-27,11,East real various they unit I.
55,300,2022-08-30,15,Western tree he type. Happen cell movie market.
372,258,2022-12-13,18,Leave data blue down.
508,654,2022-07-02,9,Low contain respond trial manager indicate.
399,661,2022-11-20,2,Family them practice write marriage structure.
313,546,2023-08-29,10,Case until where group TV get likely.
159,384,2022-04-13,17,Series any car majority into agency role.
303,548,2024-04-04,24,Sing election write save own be drug.
506,444,2021-11-08,13,Cold land science history here party.
241,584,2022-06-15,21,All group before yard.
400,131,2021-04-22,6,Against both chance piece onto.
239,566,2021-07-30,16,Officer young evening full home financial.
460,499,2022-05-01,1,Special security former east anyone.
124,13,2021-11-07,16,Or language parent best along.
483,591,2021-11-19,15,Total issue economy itself.
546,1,2022-05-20,7,Free finish let factor.
334,361,2022-02-19,18,Most somebody tough.
620,611,2022-01-27,17,Lead write those as.
471,92,2022-08-09,5,None piece natural decade. Or able wide.
317,199,2021-11-09,4,Crime tough cause.
308,94,2021-05-27,1,Cell coach test full lawyer.
548,225,2023-02-28,12,Interesting my join.
635,79,2022-03-15,11,Water interest article although art teacher.
672,641,2021-11-30,6,Business raise threat build morning month.
180,640,2022-09-21,18,Issue again across authority.
274,399,2021-11-15,17,Step field year enjoy federal fear certain.
265,319,2023-02-24,17,Writer seek image finally his.
312,171,2023-07-15,2,Data after half single wind such garden here.
13,557,2021-09-14,21,Three bank school kitchen impact seem system lay.
162,251,2022-12-05,24,Base make less at.
341,690,2023-02-20,14,Run use anyone force road store land require.
373,647,2022-10-09,14,Summer season second.
481,6,2023-12-23,24,Risk others stage bag hold particular gun.
412,99,2022-04-12,6,Now or listen fine cell population.
79,308,2023-07-14,2,Without pretty exactly car.
623,400,2022-04-13,12,Camera class detail despite ok.
109,678,2022-02-01,7,Half that ten already job reduce.
50,692,2021-12-26,24,Structure national interview.
256,57,2022-04-03,22,Civil compare child likely international.
37,634,2022-10-15,5,Arrive high brother seek pay piece.
230,436,2021-11-02,19,Western arrive among well rich deep nearly.
414,343,2022-11-14,13,News chance experience cold rather.
345,4,2021-12-26,19,City effort natural statement.
492,118,2021-06-01,16,Teach boy lot plant lawyer. Game them might.
380,341,2022-12-04,5,Doctor beautiful us throw specific town.
272,280,2021-08-20,18,Event nature serve within meet.
491,226,2022-03-09,12,Item set study age man. Race free as mention.
187,160,2023-07-14,17,Develop every here technology whether.
513,422,2023-05-30,9,Artist change degree really make.
543,169,2023-05-11,3,Leg some per and get international choice.
427,601,2023-12-11,2,Store foot hold.
394,123,2024-03-21,24,Prepare down trial several statement.
632,331,2022-11-30,16,Plan we however culture kitchen.
31,574,2022-07-09,1,On grow science campaign staff.
589,564,2022-05-26,23,Hope sense receive success upon hundred.
457,490,2023-06-07,7,Collection home gas wall research.
440,350,2021-07-25,22,Cell least company contain indeed way or.
157,679,2022-06-10,16,Score its skill of picture development.
362,659,2024-02-11,9,Culture garden specific.
169,62,2023-02-02,19,List energy loss these seem bag serious.
697,230,2022-09-18,8,Value three finally turn.
26,432,2024-03-16,19,Pattern at song community commercial suddenly.
395,244,2021-10-22,6,Care between fear no local.
42,342,2022-03-12,20,Health return feeling.
105,658,2022-12-19,9,Fear surface rate seat letter.
674,511,2023-06-22,19,Behind face federal administration community.
618,200,2023-08-08,21,Line pattern mind agent test.
73,627,2022-10-03,12,Cover and even.
48,117,2022-07-03,2,Write public event minute.
663,253,2023-07-16,6,Western special research message.
57,220,2024-03-11,4,Green better business gas computer spring.
688,18,2021-09-23,7,Left laugh candidate risk.
137,104,2022-06-28,19,Plant feel resource worker relate institution.
288,167,2023-02-28,22,Personal him run activity modern serious.
16,221,2023-03-19,12,Check pretty imagine.
183,327,2022-06-17,6,Mean week against.
670,354,2021-06-23,22,Chance him whole it.
186,411,2023-09-24,12,Rich language think. Record effect art back face.
464,549,2022-04-25,1,Single need administration imagine.
115,39,2021-12-28,23,Fly system room anything quickly look create.
469,21,2023-03-06,22,Feel place trial reveal fast.
375,329,2023-06-28,9,Past per he difference.
190,283,2022-08-06,15,Consider law decide control office.
232,272,2022-06-28,3,Add always wait car.
267,114,2023-04-18,19,Resource nation indicate spend attention join.
352,475,2023-12-05,20,Full positive cup understand significant create.
167,622,2022-08-21,24,Tonight true begin relationship day fire.
286,254,2023-05-05,3,Traditional north society yes friend call.
165,630,2024-01-14,1,Change family show yes check difficult.
409,321,2023-01-31,17,Discussion always everything herself message.
552,306,2022-04-15,17,Particular detail back little.
554,204,2022-05-20,22,Item option late hair voice.
282,313,2021-05-18,22,Positive try rather where suggest.
106,683,2024-01-17,15,Leave drug simply read.
138,688,2021-10-03,6,Exist option say worry always hot know these.
314,674,2023-06-02,21,Cultural low reduce can beautiful the.
524,129,2021-11-09,23,Treat change color when affect floor force.
687,463,2022-02-11,13,Technology each yes person add one company.
253,403,2021-09-21,8,Family Democrat among believe produce collection.
490,275,2022-03-06,23,Strong factor organization page thought.
8,116,2022-12-03,22,Seem lay they all night past.
33,610,2023-10-21,21,Thank structure forget evidence.
213,502,2023-09-20,9,Edge huge board experience.
84,36,2023-02-08,17,Bill school five middle.
385,381,2022-10-18,18,Him system drug experience actually how.
257,218,2021-07-05,23,Strong factor rate for would.
588,563,2023-05-31,18,Interview trade administration son.
323,500,2022-12-30,19,Hospital cause understand about public.
278,687,2022-01-30,17,Mother remain last travel better skin chance.
370,519,2021-11-01,24,Entire condition form clear also tonight among.
695,597,2022-01-06,16,Group professor position gun save leg.
518,580,2024-03-04,19,Congress else surface challenge top crime serve.
655,240,2023-01-09,1,Yes appear movie bad notice face deal.
151,626,2022-07-18,23,Home card sure sit yeah. Send business game do.
403,473,2023-01-30,23,Public most along.
228,336,2023-11-09,15,Understand dream practice establish behavior.
402,613,2022-12-10,1,Face detail last mind place.
683,694,2021-09-15,5,What various show a join. Drug piece safe modern.
82,581,2024-01-03,24,Late gas evening generation night.
292,419,2022-08-03,2,Leader moment break require Mr range.
613,664,2023-10-29,15,Ok since deep pick budget.
601,29,2022-11-05,4,Almost center show study research everyone.
207,352,2024-03-04,10,Season open word near. Tv series with history.
415,363,2023-08-31,15,Film choice score beat admit morning.
209,426,2023-12-11,20,International enough form let.
516,442,2023-08-01,18,Eye may national activity money yourself life.
665,31,2023-02-21,8,Peace finish try song politics.
12,122,2023-11-08,15,What own which note follow despite need.
629,529,2021-07-06,8,Term yeah now enter.
654,288,2023-11-27,19,Friend at compare dog idea campaign that.
283,556,2023-08-20,14,Customer field blue discover.
349,677,2021-05-31,19,Drive likely right carry.
333,46,2022-10-14,8,When represent cold air recent.
493,536,2024-01-14,11,Suffer entire hair none human set easy.
681,323,2023-05-02,7,Commercial much wear around another set.
488,52,2022-08-13,12,Century million beautiful these site strategy.
