id_personal,id_publicidad,fecha_asignado,tiempo_asignado,trabajo_a_realizar
252,257,2023-03-05,11,Various establish knowledge authority.
168,440,2022-05-04,13,Idea break laugh lot admit.
74,172,2023-04-22,9,Than good road baby specific want shoulder.
573,439,2023-01-27,22,Record own on perhaps.
451,162,2024-04-10,7,Cup company property leader use focus.
494,214,2023-07-06,14,Garden debate hand house.
699,667,2024-01-03,12,Everybody western loss six.
622,413,2024-04-08,19,Interesting hear officer where.
473,447,2024-01-20,2,Always policy serious young today no different.
25,139,2021-06-05,18,Television notice check security.
487,478,2022-12-05,13,Husband together staff small.
210,558,2023-01-17,10,Want usually back land chair.
45,50,2022-08-12,14,Those now color movie charge director use.
178,689,2021-07-27,21,Safe else term all issue bag.
578,537,2024-02-03,16,Off course establish east.
205,81,2024-01-31,23,Something center hospital sister.
134,534,2021-10-15,11,Customer against because only ahead.
669,458,2022-09-14,7,You source option series small they space.
99,216,2022-11-16,2,Every front worker team week bank.
208,293,2021-09-04,16,Personal official Congress.
678,7,2023-11-05,20,Industry gas plant option simple safe model.
189,516,2023-09-19,9,Region keep theory data bring.
254,485,2021-04-24,18,I military sound catch street surface above.
22,686,2024-02-22,1,Describe process his simple detail large.
356,77,2021-05-23,7,Truth us personal send.
259,340,2021-06-08,1,About break rather account establish.
474,474,2021-10-20,24,Bag daughter board media training able else stay.
332,163,2021-09-05,8,Hit station yard thousand.
455,157,2023-12-10,18,Tend something find relate nor.
447,633,2022-05-11,1,Church force art toward.
576,608,2023-10-21,2,Entire station admit federal care.
550,587,2024-04-13,1,Customer person thank many near wait.
626,5,2023-09-23,20,Decade see growth religious challenge live.
484,26,2022-01-26,15,Around stage city not last.
347,512,2021-10-29,16,Way feel to customer. Soon positive also term.
398,109,2021-10-27,4,Win sometimes line quality later often think.
188,476,2023-12-13,22,Main else throughout president certain.
337,264,2021-12-20,19,Entire just recently anything member.
596,287,2023-09-04,20,Hospital space cup sing.
525,103,2024-03-20,3,Yeah make right. Network whether worker them.
306,335,2022-09-18,3,Detail current voice decade.
290,578,2021-07-19,9,Edge population there discover left author those.
294,533,2022-04-20,15,Paper coach plan wall detail quite small.
667,396,2021-12-31,20,Degree few goal into market something second.
564,78,2022-02-04,14,Kid organization maybe who relationship.
182,466,2022-12-02,12,Movie listen down.
448,625,2023-05-20,7,Money third also risk rock short might probably.
316,346,2024-04-07,18,Act name market prevent later activity mean.
374,168,2022-01-24,2,Stand think prove she side instead best.
40,285,2021-06-01,11,Scientist capital imagine reveal believe.
584,697,2021-09-04,23,Crime husband during size.
244,599,2024-02-01,18,Seem anything away within.
567,145,2021-08-01,7,Single mean form discuss commercial director.
196,211,2021-10-10,22,Movement easy moment message teach upon.
18,271,2022-09-10,2,Go professor few ago but cell Mrs.
361,526,2023-10-02,2,Purpose very answer reflect.
476,215,2023-08-14,23,Simple drug beyond when between state.
581,252,2021-05-09,11,Performance policy class case claim.
354,282,2022-09-12,21,Major maybe toward region easy structure simply.
571,32,2022-06-26,3,Such resource body information.
353,261,2022-12-10,24,Anyone fly identify picture yeah food.
466,3,2021-11-18,7,Three blood list result group.
507,184,2022-02-17,1,Them figure house represent.
477,553,2023-08-16,2,Impact federal purpose represent build.
139,93,2021-10-24,16,Property policy choose development indicate.
3,317,2021-12-02,24,Method weight factor report. Career today board.
46,71,2021-12-17,8,Professional such knowledge eat.
368,278,2023-12-24,24,Blood store behind base. Arm almost attack.
258,209,2023-03-10,24,Pull fill state.
245,134,2023-09-21,12,Industry dog fear let team drug fast.
19,237,2022-11-06,11,Gun need dinner price also half after could.
150,37,2024-03-15,15,Away board hotel.
633,391,2024-03-24,19,Involve region together whatever how.
512,638,2022-04-06,8,May require material draw recently whatever.
612,312,2023-12-16,23,Whatever necessary computer since necessary.
330,222,2023-11-18,8,Southern page one might involve.
302,356,2023-07-09,24,Next large stock whom civil where Congress.
227,59,2023-08-19,4,Morning cell chair should question include carry.
456,135,2023-12-14,14,Tell add now wall former focus really.
553,483,2021-05-21,24,Seek six point plan speech.
436,510,2024-04-04,16,Agency machine style soon structure.
201,22,2022-05-16,2,Change candidate force risk.
680,153,2021-05-09,19,Everybody past able.
538,651,2023-05-22,17,Movement ahead like food generation.
537,372,2022-01-26,13,Bed possible them eat kind.
4,357,2023-03-15,12,Whatever new himself citizen woman.
509,49,2022-07-05,1,Career poor particularly economy you.
235,234,2021-12-10,4,Increase fear bed.
91,85,2023-01-14,14,Sure thousand life around former key.
384,554,2023-02-06,12,Rather speak other hot.
1,542,2022-01-13,17,Year race actually there compare its.
462,180,2022-04-15,19,Enter pattern cover send nor investment throw.
236,570,2021-11-09,16,Follow condition we rate act onto service.
211,382,2023-11-16,11,Discover young buy than still.
452,45,2024-02-11,15,Recent police local window another.
104,644,2022-04-23,4,Law relationship agent foreign.
87,469,2021-12-22,11,Television police test pick cost child.
315,324,2023-09-23,12,Spend approach part realize store carry fill.
305,196,2022-08-19,23,Protect they remember.
72,434,2022-04-03,23,Article skin brother better.
243,166,2022-04-09,13,Low safe still especially strategy determine.
542,90,2022-06-15,24,But occur attorney peace.
97,53,2021-11-08,16,A white part program.
390,24,2023-06-24,9,Rise detail describe course part.
465,425,2021-09-01,7,Nice finally together outside.
529,164,2023-11-11,5,Often poor research organization wrong film.
489,223,2023-04-06,3,Song program protect everyone ever.
30,30,2022-09-07,22,Tell real wait whom.
108,305,2023-02-14,2,Tax learn knowledge board call.
111,573,2023-10-25,23,Thank officer minute develop present blue.
284,446,2021-10-23,9,Concern career cost try north senior deep.
646,345,2023-10-20,9,Hundred machine occur throughout office.
410,161,2021-04-22,20,Among citizen yard point still to doctor.
388,274,2024-01-22,23,Bar our mission lay.
393,596,2022-03-12,5,Child floor American ready site.
206,577,2023-02-19,2,Stock open off yet finally she.
309,467,2021-07-26,24,Style these determine.
234,55,2023-10-03,20,Job field sometimes short pretty sense ask.
51,462,2022-03-13,2,Under degree smile someone thing want bit.
351,377,2021-12-12,24,First group play save than sell involve source.
103,522,2024-03-25,18,Leader someone recent smile necessary.
23,429,2022-10-01,12,Movie low media worker. Great strong girl.
197,544,2022-09-29,23,Suddenly thank article raise.
81,100,2022-12-07,3,Begin machine image expert page door.
397,112,2022-12-25,21,Experience still walk drive change late tonight.
116,72,2023-02-03,19,Idea prove day have dinner.
636,488,2023-02-13,17,Range across beat task send east least.
319,68,2022-01-17,7,Effect ever onto trade.
522,585,2022-04-15,2,Crime continue yet.
640,132,2022-04-26,14,Site play according usually.
594,437,2021-06-13,10,Store few member seek.
563,409,2024-01-02,6,Something indicate begin nature career kind.
671,193,2021-11-06,18,Above bar idea not film form too.
528,541,2023-10-23,22,Myself speak policy position lead east she.
166,294,2022-05-03,9,Side if window pick.
413,495,2023-03-14,11,Seven herself property media woman.
421,233,2023-07-07,19,Program charge sing material clearly.
660,383,2022-07-28,11,Natural store world song. Media back see lot.
549,141,2022-07-15,1,Hit follow beautiful interview deal.
577,358,2023-01-04,20,Simple whose must activity weight west free.
597,74,2023-08-09,16,Collection white consider over movie risk past.
580,486,2023-07-31,17,Because push new several including.
461,560,2023-12-01,13,These why house imagine condition.
164,614,2023-08-19,1,Buy tonight necessary subject.
382,648,2021-06-13,24,Although full read development occur force.
32,616,2021-05-24,17,Civil decision home car new security I.
611,318,2022-12-25,4,So water another red while.
558,243,2022-04-12,17,Drop less ahead official let keep.
685,392,2022-06-07,5,Hear part side.
392,82,2024-01-22,24,Say attack sign show city management.
304,395,2024-02-15,8,Without practice hair air.
117,450,2022-05-05,21,Account project rich research despite growth.
5,421,2023-02-11,9,Difference lead partner energy everything reason.
607,158,2022-04-21,6,State school response less case short.
225,197,2022-10-26,21,Turn later expert stop tough cost.
280,188,2021-11-24,9,Should subject wish then kid since be.
287,700,2023-02-05,18,Group agent life imagine.
7,433,2021-05-04,20,Language join raise return.
343,182,2021-10-26,5,Accept no study others. Book one foot along.
551,23,2022-04-23,8,Game painting tough kid way miss become.
47,359,2022-08-06,18,Assume along move. Speak student very once.
531,328,2023-06-11,1,Leg statement agreement tree deep in.
193,97,2023-02-19,14,Project that throw think state.
396,643,2023-04-17,5,Look try win only.
432,48,2024-04-08,5,Film provide gun food increase sure.
92,156,2023-10-26,21,Security return figure compare eat.
237,181,2022-09-09,4,Feel throw character turn either force shoulder.
364,263,2022-04-21,7,Drug should catch tough involve.
480,496,2021-11-16,19,Surface student camera offer laugh bed.
67,217,2022-11-04,13,Interview page fund science into speak.
268,98,2021-12-09,12,Bed government beyond direction something role.
14,250,2023-01-06,11,Activity shake such enter five wife southern.
371,246,2021-07-11,9,Sometimes strong without bag can.
271,673,2021-09-07,4,Race glass within. Music raise ever key card Mrs.
41,185,2021-12-09,17,Economic second good memory argue woman.
318,652,2023-09-29,23,Across visit you individual whatever.
216,102,2022-04-25,7,New bag many young trip talk.
651,539,2022-04-05,17,Begin suddenly turn author.
143,670,2021-11-29,5,Heavy peace husband media break goal.
574,501,2022-02-21,4,Step window democratic.
617,604,2023-05-05,14,Common hear mean case camera move.
614,12,2023-07-15,4,Wait as ago free outside.
668,128,2021-07-20,7,Economy across mean talk.
250,390,2023-01-12,7,Example suggest hope thing standard.
401,110,2021-06-27,22,Management guess participant late bill.
63,191,2023-05-09,12,Tough off card pull than.
593,453,2023-09-07,18,Professional what student sing possible.
539,203,2023-08-01,22,Despite huge still we message across before.
485,398,2022-05-23,21,Join state model commercial.
405,504,2022-12-06,11,Because collection nation our food.
120,646,2022-11-21,6,Thing my approach sound.
365,119,2022-02-17,17,Prepare reduce popular pay or enough direction.
694,456,2021-10-01,8,Standard large almost policy.
90,373,2023-03-29,19,Analysis miss position ask bit scene.
350,397,2023-01-19,19,Wind man top far surface production.
2,607,2024-01-29,8,Detail fact agree test reason stuff.
423,273,2021-06-05,22,List our paper so card. Sea six social prove.
61,202,2023-08-29,22,Play always hotel part popular artist hotel.
221,262,2022-09-22,8,Foot station item north need body.
498,303,2022-07-24,15,Between measure skill exactly cup address.
322,266,2023-11-24,1,Remember one your edge authority.
38,506,2022-03-11,22,Best save summer.
53,465,2023-07-02,14,Factor also beat there.
321,360,2021-08-12,10,Man product figure heart.
247,106,2022-02-10,8,Industry amount get wear yard.
170,576,2024-02-15,14,Along husband tax four center rise party.
93,133,2022-07-10,2,Save care free improve fact.
59,370,2023-04-27,24,Forward from threat always song.
579,668,2022-04-09,14,Bill else in avoid.
171,583,2023-08-15,5,Cup turn rule move can me mean.
114,76,2023-01-25,1,Wall Democrat although per.
328,568,2022-11-03,19,Well mean account business job American.
311,20,2022-02-04,17,Note crime relationship.
329,140,2022-08-16,22,Debate character happen ability suggest wonder.
510,407,2022-07-18,21,Measure more per president surface your.
158,693,2021-06-21,23,Local site attention lose amount.
625,565,2023-12-13,8,Adult case finally such west buy agreement.
449,586,2022-04-22,14,Rule executive international hot method.
344,88,2021-12-23,17,South list tend well region second month federal.
62,662,2021-09-10,13,Mr control cut fly story business themselves.
590,513,2021-12-02,7,Area above property quality TV example Congress.
226,402,2021-12-23,9,Name great pass.
657,555,2022-03-15,12,Whose through key let.
647,617,2023-02-19,15,Fish exist middle while special.
141,669,2021-07-30,20,Nor type hard unit break talk Mr.
123,375,2021-06-26,2,Space cut late idea let nice.
76,224,2022-08-08,21,Keep big significant sing outside employee.
142,449,2021-06-28,10,Provide tree room.
391,256,2023-05-08,5,It value author. Church season road likely buy.
568,297,2023-05-17,24,Artist off range identify system style site.
575,538,2023-11-17,3,Decision economy born carry.
609,84,2022-12-31,9,Sure certainly image us everybody listen.
96,242,2021-10-14,17,Inside religious morning east.
326,95,2022-03-24,22,Every require hope practice front.
181,87,2023-10-29,1,Special kitchen better.
644,56,2023-12-31,17,Rest authority fast threat gas thing.
357,379,2024-02-08,18,Safe believe create tough fast fly not.
107,618,2022-02-06,21,Fear time purpose hit maintain offer blood.
122,637,2022-09-27,7,Future pass heavy find east.
70,503,2023-01-11,19,Bad pay and fast in pretty.
583,430,2021-09-03,4,Shoulder region everybody.
132,653,2023-10-12,6,Hot guy federal box trip service wear.
523,649,2021-11-03,22,In whose interview in case group trade.
627,124,2023-03-02,23,Step yet key few doctor song American.
160,527,2021-10-17,5,Across cup this live others particular.
504,472,2021-05-01,10,There group either drive lay though laugh.
444,279,2024-04-12,13,Democrat condition difficult.
195,386,2022-01-07,21,Clearly break to. Inside PM player me.
673,51,2021-07-22,6,Kitchen market buy your create process form.
289,245,2022-02-09,14,Generation by happy best relate.
700,277,2021-06-07,2,Respond hot would goal.
425,569,2022-09-09,9,Cup card loss better rather he unit official.
64,445,2022-02-09,7,Analysis him wear enter story.
194,19,2022-02-21,19,Return arm happen heavy part popular.
643,479,2023-08-11,3,Power why home wear something remember.
591,543,2023-07-07,9,American lead big concern.
233,415,2021-06-10,18,Single market occur very.
416,67,2023-02-16,16,Need positive argue here.
679,152,2023-10-29,5,Discuss realize growth listen item part owner.
199,423,2023-10-02,5,Painting support try.
486,179,2021-08-31,15,Section Mrs drug few daughter report.
140,405,2022-02-17,24,Task rule record century late.
545,448,2023-12-28,19,Beyond evidence everyone why woman democratic.
479,314,2022-10-24,3,Matter build figure woman place charge edge.
133,175,2024-03-17,5,Manage value girl religious test inside bag.
175,514,2024-02-01,12,Go account reason drive.
467,310,2023-03-28,3,Catch others face six sit capital they.
277,238,2022-06-08,9,Hot city goal.
49,452,2021-07-28,19,Pay up treat really chance many age.
346,380,2021-05-01,4,Source old sound beyond military practice.
639,699,2022-06-23,12,Discover only these college occur name report.
320,602,2023-09-30,18,Suggest group nation vote support.
472,656,2022-09-28,3,More however life street many plan.
246,295,2023-04-12,5,Study real risk hospital.
517,205,2023-09-10,24,Their future determine could college.
10,494,2022-11-25,21,Road result smile young drug rise whose.
35,443,2023-07-22,12,Couple method per quality.
24,136,2023-03-12,5,Product practice cost reveal.
682,592,2021-05-25,4,Enough federal off modern.
482,589,2022-11-14,20,Occur memory include shake decide.
54,89,2022-01-30,6,Agreement wish kind couple shoulder.
39,201,2023-03-17,4,Wind answer although. Today almost trip leader.
281,2,2021-07-15,3,Position apply until. Level beyond far as image.
88,265,2022-09-08,11,Policy media detail let center rock.
454,393,2024-01-18,20,Some in all mouth hit culture.
348,605,2022-07-25,15,Man each ball stop political join.
442,349,2022-09-25,7,Campaign war itself yes step event though.
44,241,2023-08-19,18,Happy responsibility arm common table left.
152,593,2023-04-16,9,Late money oil fight service sea.
514,120,2022-09-19,9,Born until country personal. Girl one perform.
497,508,2022-02-03,23,Worry stuff apply statement.
340,520,2021-05-23,11,Fact finally special.
298,183,2022-04-20,22,Center turn situation many simple.
582,259,2021-11-07,9,Reflect will drug clearly.
377,540,2022-10-29,20,Develop base identify few.
231,248,2022-08-13,24,Couple tree participant win.
378,176,2023-08-03,21,Scientist size blue prove that somebody board.
502,406,2023-09-08,5,Pass consumer four right.
569,477,2023-12-17,23,Exactly represent party culture.
603,487,2022-09-19,4,Down lot fish court suddenly score.
331,83,2023-04-21,19,Go perhaps ball. Personal data class ago them.
65,8,2022-06-23,18,Must arm visit.
172,455,2022-09-27,13,Action rise term really peace.
666,484,2023-10-26,22,Thank kind then let report.
325,235,2023-10-15,22,Television ok dream give threat method worker.
285,344,2022-02-04,15,Big model look black behind these run.
662,374,2022-01-11,11,Type central born forget. Less page vote.
610,606,2022-07-25,15,Quality state physical under well.
381,461,2023-08-13,15,Box reveal apply watch while address.
251,552,2023-02-15,9,A hair white.
155,260,2023-04-03,17,Government term remember myself compare.
422,10,2023-07-03,20,Movement develop lose should court plan poor.
179,441,2024-01-17,4,Growth long memory page at successful represent.
156,108,2021-07-17,3,Wide million treatment force.
638,351,2023-12-03,23,Same these less large peace.
556,561,2023-07-13,20,Not quite car base federal whole.
496,111,2022-08-03,12,Live try scientist away development.
404,105,2023-10-22,14,Color middle fact money trip ten game.
20,657,2022-05-01,12,Idea day knowledge president measure base.
441,269,2023-02-06,16,Foot most hospital around Mrs.
212,480,2022-11-23,23,Be politics Republican attack Republican effort.
146,255,2023-06-06,22,Year that customer reach as.
335,143,2024-01-09,7,Blue sister argue old possible point.
131,339,2023-07-04,13,New even one nice.
592,620,2024-02-26,13,Pretty need expect truth.
136,41,2023-06-15,12,Same deal office audience item.
689,572,2021-08-15,13,Event blood control similar toward however.
310,523,2022-05-16,8,Time interest go sense music future among.
299,107,2022-08-24,8,Coach hear only might describe brother.
664,369,2021-11-13,14,Explain while health voice.
433,531,2023-02-21,1,Two yeah account eye where protect early.
126,505,2024-03-04,22,Return support ever letter.
255,347,2022-11-23,3,Campaign sell outside simple candidate west.
634,366,2023-07-29,4,Growth staff amount daughter job lay.
696,228,2024-03-09,16,Idea rich save cut.
127,236,2023-03-29,21,Mother under professor real that moment only.
544,326,2022-04-28,6,Method take service night explain.
616,457,2023-06-12,3,Yet resource worry movement happy seat produce.
645,636,2022-02-19,10,Always side student two significant far red.
535,290,2023-06-12,24,Whose question turn my guess.
147,672,2022-02-11,14,How fire listen both impact.
430,170,2024-03-07,10,Partner surface out born sing single future.
637,281,2022-06-22,8,Garden final who. Practice feeling want others.
619,144,2022-11-05,12,Record finish production final event way.
198,101,2023-08-14,12,Seek field system local.
631,44,2024-01-22,22,Tend hundred unit very research.
327,154,2023-06-10,7,Couple half guy attorney chair manager cell past.
587,353,2022-02-14,6,Word military discussion series resource artist.
562,198,2023-11-12,22,Continue low central stop.
411,676,2021-06-13,14,Subject later individual.
547,155,2023-11-05,16,Education accept bar voice. Almost rise increase.
566,388,2022-07-12,14,Challenge ten will adult the area garden.
293,385,2022-07-19,24,Play member data.
561,284,2023-10-28,15,Activity feel president bit.
598,509,2022-11-19,18,Bar voice although western put poor.
60,69,2021-07-20,3,Quality threat which forget right later.
692,621,2022-05-27,17,Argue bar similar develop building stop fast.
214,190,2021-08-19,2,Writer best court some good box.
424,270,2022-11-08,20,Little foreign third instead dark weight TV.
434,681,2023-07-27,16,Young short young reach reduce tonight.
560,315,2021-05-15,1,Enter throw store.
533,286,2022-01-11,16,Plan force when each explain long single.
453,491,2022-05-15,8,Car improve start media interest try strong.
154,471,2021-07-27,10,Describe difference bed boy.
17,334,2023-01-05,8,During off item.
426,394,2024-01-20,15,Conference blood risk born.
389,174,2022-02-21,13,Travel though member Congress move share.
148,635,2023-11-13,6,Successful author first series sometimes value.
184,73,2022-07-17,2,Teacher successful lot action.
176,698,2022-06-08,7,Mind interview baby home picture skin claim.
519,28,2023-06-09,21,Group forget among affect wall.
342,61,2021-11-16,21,Thought meeting beautiful glass.
296,684,2024-01-31,20,Kitchen box ask hit table think.
661,517,2022-07-01,23,Compare Democrat risk local.
599,632,2024-03-22,7,Thank answer project occur.
144,91,2023-01-22,4,Some color fill offer six begin sit.
499,650,2023-01-30,7,Establish behind movement list.
80,127,2021-08-20,21,Foot job now resource simply sense.
386,322,2021-06-08,23,Maintain audience soon couple leader experience.
602,65,2022-03-24,18,Significant yeah use attack law.
78,17,2022-05-12,19,Entire open compare out ago consumer modern.
526,365,2022-05-14,13,Deal interest chair represent media direction.
383,492,2022-06-19,23,Live civil year more care Democrat.
29,666,2022-09-30,6,Girl speech real or pretty as.
191,603,2023-08-27,23,Central either wait four guy.
153,631,2023-03-08,17,Human prepare a argue bed suddenly these.
163,229,2023-11-25,12,Office age watch meet when bit.
418,524,2021-05-06,5,Know region note allow read sister similar.
238,195,2022-10-04,9,Middle make develop professional.
606,482,2023-05-09,13,Rest full media future Democrat.
570,296,2023-12-02,9,Safe in continue issue image sense song.
359,332,2023-02-03,1,Operation another pay key nation measure enter.
192,515,2022-03-03,10,Thus deal quite again.
28,11,2022-03-13,6,Future suddenly water parent industry.
56,609,2022-02-14,1,His young behavior hospital.
260,619,2021-10-15,16,Significant worry join garden political.
275,309,2022-09-26,20,Wear whether country bill whatever.
650,468,2023-05-07,8,Sea inside light government break.
300,408,2024-03-04,11,Image sea provide view.
406,213,2022-03-03,12,Half make alone. Future room long try end serve.
324,47,2023-09-12,5,Upon important measure these husband.
242,40,2022-03-29,4,Answer cause great lot still ground how.
94,410,2024-03-31,6,Beyond quality collection own on my.
565,147,2022-11-16,8,Enough ever senior tax fly take ask.
676,680,2022-10-06,17,Finally truth rich attack poor meet various.
98,682,2022-06-09,19,Defense leg team compare end animal huge student.
218,355,2022-02-17,20,Hotel end improve energy give.
536,113,2023-04-15,24,Key clearly describe forward.
478,14,2021-09-30,9,New former draw modern alone rich.
366,16,2024-03-20,1,Open music work score high ok single.
177,696,2022-05-04,17,Hair enter rest doctor it information nature.
387,454,2022-06-22,11,Amount peace room often perhaps race.
437,623,2023-12-14,15,Pressure state Mr radio live.
419,173,2022-10-23,22,Force water dark impact truth operation billion.
369,588,2023-03-16,21,Party reach low trial.
615,304,2023-03-22,4,Behavior provide figure baby week red couple a.
130,137,2021-04-16,21,Home yet number step order stage provide.
217,208,2022-03-26,4,Or beat term present skin floor learn.
297,159,2024-01-10,15,Risk describe consumer road inside then accept.
459,629,2023-05-22,20,Treat others religious himself.
112,330,2021-07-19,7,Chance manage guess option power sit week.
367,299,2021-08-17,8,Campaign face vote over write effort relate.
269,316,2021-04-17,6,Process value sometimes spring control.
69,239,2023-02-22,20,Want eye between Mr.
204,438,2022-06-06,24,Radio country position whom region national ten.
223,150,2023-04-16,8,Wait young same into born strategy.
83,130,2023-02-02,17,Analysis yes safe politics various many today.
698,567,2024-02-08,16,Part son base.
585,595,2021-10-17,1,Past across physical.
693,333,2022-05-18,18,To PM conference arrive out easy wife.
102,187,2024-03-03,3,More rather democratic yourself expert.
659,695,2022-04-09,4,Speak key source stop national decision.
439,420,2022-12-31,18,Herself type drug. Even seven child.
338,521,2023-06-01,11,Top property own place once.
58,96,2024-03-15,24,Personal individual onto word realize exist.
690,665,2024-02-11,24,Series officer painting month lay end.
270,575,2021-11-07,4,Body method point control outside indeed they.
463,459,2023-08-07,10,Authority middle form leave.
572,417,2021-07-11,4,Key these matter ever sometimes police.
527,206,2022-08-31,21,Imagine store about draw they film ahead real.
559,387,2023-11-23,19,Bad machine begin.
43,63,2021-08-13,16,Sing fall work raise radio him.
675,27,2023-01-16,1,Experience gas computer six movie instead.
220,121,2023-03-15,7,Move free physical shoulder.
307,571,2023-10-28,21,Like window would detail control sell.
249,142,2023-12-28,1,Others fire stop about camera day organization.
648,86,2022-02-12,21,Almost water president how.
495,60,2024-03-20,2,Friend unit final open.
100,532,2021-10-23,20,Determine something actually strategy government.
355,15,2024-01-17,16,Care others it pattern carry.
110,600,2023-08-18,10,Wear other place.
200,362,2022-11-10,2,Much end song. Eat less explain participant say.
